{
  "schemaVersion": "1",
  "principal": "Cooper Corbett approving; current Codex implementation goal executing as crcorbett",
  "identitySource": "User approval on 2026-08-20 plus GitHub and Vercel identity readback",
  "localWrite": true,
  "externalAccess": "mutation",
  "operations": [
    "create or reuse one dedicated taxkit-ci-cache Vercel project without deployment",
    "create one project-scoped Vercel cache token expiring no later than 2026-11-18",
    "create or update the TURBO_TOKEN GitHub Actions secret and TURBO_TEAM GitHub Actions variable",
    "configure Vercel Remote Cache, Bun package cache and Playwright Chromium cache in the workflows named by the SPEC",
    "run and read back the hosted Quality and trusted workflow cache proof required by TCC-001 through TCC-005",
    "rotate, revoke or remove only the cache credentials, variables, project and workflow bindings created by this goal when rollback is required"
  ],
  "resources": [
    "Vercel team cooper-corbetts-projects",
    "Vercel project taxkit-ci-cache",
    "GitHub repository crcorbett/taxkit",
    "GitHub Actions repository cache secret and variable",
    "GitHub Actions environments named by the active SPEC",
    "TaxKit Quality, Preview, Production, Teardown and Receipt workflows"
  ],
  "environments": [
    "local explicit cache opt-in",
    "pull request with read-only remote cache and fork-safe fallback",
    "push to main with trusted remote cache read/write",
    "github-actions-report-only",
    "taxkit-docs-preview",
    "taxkit-docs-preview-teardown",
    "taxkit-docs-production"
  ],
  "duration": "The active Turbo and CI Cache Efficiency SPEC goal, with the Vercel token expiring no later than 2026-11-18",
  "revocation": "Cooper Corbett owns immediate Vercel token revocation and GitHub cache secret removal; the implementation goal owns workflow and project rollback readback",
  "approvalRequired": true,
  "approvalReceipt": "User message on 2026-08-20 granting pre-emptive approval for the tasks needed to complete the SPEC and selecting the Cooper Corbett Hobby account",
  "stopConditions": [
    "stop if the Vercel team, GitHub repository or authenticated identity differs from this envelope",
    "stop if a credential cannot be limited to the dedicated TaxKit cache resource or bounded team cache operation",
    "stop before exposing a token value in repository content, logs, receipts or user-facing output",
    "stop if pull-request execution can replace a trusted main result without a checked read-only or isolated boundary",
    "stop before deployment, publication, release, DNS, merge or unrelated provider mutation"
  ],
  "readback": [
    "Vercel team owner role and Remote Cache enabled status",
    "dedicated project id and no-deployment state",
    "token id, scope and expiry without bearer value",
    "GitHub secret and variable names without values",
    "workflow source revision, event, cache hit or miss and uncached fallback",
    "post-rollback absence or replacement identity when rollback occurs"
  ],
  "rollback": [
    "remove workflow cache bindings while preserving the complete uncached command graph",
    "remove the GitHub cache secret and variable created by this goal",
    "revoke the exact Vercel cache token",
    "remove the dedicated empty Vercel cache project only after token and workflow detachment readback"
  ],
  "escalation": "Stop the active task, retain the failed or partial receipt, and return to Cooper Corbett with the exact identity, scope, event or rollback mismatch"
}
