{
  "schemaVersion": "1",
  "principal": "crcorbett",
  "identitySource": "2026-08-20 GitHub gh api user and Vercel CLI whoami readback",
  "localWrite": true,
  "externalAccess": "read_only",
  "operations": [
    "inspect TaxKit GitHub repository permissions, environment names and matching secret or variable names",
    "inspect immutable GitHub Actions run and job metadata",
    "inspect current Vercel user and team list"
  ],
  "resources": [
    "GitHub repository crcorbett/taxkit",
    "GitHub Actions Quality runs 32316014670, 32305069327 and 32304045477",
    "Vercel identity crcorbett and returned team list"
  ],
  "environments": [
    "local TCC-001 qualification",
    "GitHub repository Actions metadata",
    "github-actions-report-only",
    "taxkit-docs-preview",
    "taxkit-docs-preview-teardown",
    "taxkit-docs-production"
  ],
  "duration": "The read-only TCC-001 qualification on 2026-08-20 only",
  "revocation": "This envelope ended after the named readbacks and grants no standing external access",
  "approvalRequired": false,
  "approvalReceipt": "User requested that implementation begin after the planning commit and push",
  "stopConditions": [
    "stop before choosing a Vercel team or cache resource",
    "stop before creating, rotating, storing or attaching a credential",
    "stop before any GitHub, Vercel, deployment, publication or Production mutation",
    "stop if identity or repository target differs from this record"
  ],
  "readback": [
    "GitHub user crcorbett and repository admin permission",
    "four exact GitHub environment names",
    "no repository-level or environment-level secret or variable name matching TURBO, VERCEL or CACHE",
    "Vercel user crcorbett and two returned candidate teams",
    "three immutable Quality run and step timestamp records"
  ],
  "rollback": [
    "no external mutation occurred, so no provider rollback applies",
    "discard or correct local qualification records if their source readback is wrong"
  ],
  "escalation": "Ask the TaxKit cache owner to select the exact Vercel team and approve the credential, event, expiry, revocation, readback and removal boundary"
}
